{
  "version": 1,
  "nodes": {
    "tidal-design-doc": {
      "x": 96,
      "y": 96
    },
    "tidal-art-doc": {
      "x": 96,
      "y": 576
    },
    "tidal-loop-summary": {
      "x": 96,
      "y": 1056
    },
    "tidal-desktop": {
      "x": 656,
      "y": 96
    },
    "tidal-mobile": {
      "x": 656,
      "y": 576
    },
    "tidal-harbor": {
      "x": 656,
      "y": 1056
    },
    "tidal-buildings": {
      "x": 1216,
      "y": 96
    },
    "tidal-fleet": {
      "x": 1216,
      "y": 576
    },
    "tidal-icons": {
      "x": 1216,
      "y": 1056
    },
    "tidal-starter": {
      "x": 1776,
      "y": 96
    },
    "tidal-hud-skin": {
      "x": 2336,
      "y": 96
    }
  },
  "viewport": {
    "x": 188.03100341056233,
    "y": -691.8872168538007,
    "zoom": 0.9198381276203645
  },
  "view": "canvas"
}
