{
  "version": 1,
  "nodes": {
    "main-menu": {
      "x": -1180,
      "y": -920
    },
    "blank-2": {
      "x": -640,
      "y": -920
    },
    "blank-2-2": {
      "x": 870,
      "y": -920
    },
    "hotspot": {
      "x": -140,
      "y": -920
    },
    "blank-3": {
      "x": 360,
      "y": -1210
    },
    "qte": {
      "x": 1880,
      "y": -930
    },
    "blank-4": {
      "x": 1370,
      "y": -960
    },
    "blank-5": {
      "x": 2370,
      "y": -910
    },
    "choice": {
      "x": 2880,
      "y": -900
    },
    "blank-6": {
      "x": 3350,
      "y": -1160
    },
    "blank-7": {
      "x": 3790,
      "y": -910
    },
    "blank-8": {
      "x": 4330,
      "y": -910
    },
    "hotspot-2": {
      "x": 4830,
      "y": -920
    },
    "choice-2": {
      "x": 5350,
      "y": -1260
    },
    "blank-9": {
      "x": 5360,
      "y": -500
    },
    "blank-10": {
      "x": 5900,
      "y": -1410
    },
    "blank-11": {
      "x": 6200,
      "y": -950
    },
    "hotspot-3": {
      "x": 6730,
      "y": -960
    },
    "choice-3": {
      "x": 9110,
      "y": -910
    },
    "blank-12": {
      "x": 7370,
      "y": -1650
    },
    "blank-13": {
      "x": 9640,
      "y": -1200
    },
    "qte-2": {
      "x": 10160,
      "y": -1200
    },
    "blank-14": {
      "x": 10720,
      "y": -1330
    },
    "ending": {
      "x": 11790,
      "y": -1200
    },
    "blank-15": {
      "x": 9640,
      "y": -740
    },
    "blank-16": {
      "x": 10130,
      "y": -740
    },
    "hotspot-4": {
      "x": 10670,
      "y": -740
    },
    "blank-17": {
      "x": 7390,
      "y": -1160
    },
    "blank-18": {
      "x": 8940,
      "y": -1280
    },
    "blank-19": {
      "x": 8560,
      "y": -940
    },
    "blank-20": {
      "x": 7910,
      "y": -1310
    },
    "blank-21": {
      "x": 7990,
      "y": -1810
    },
    "blank-22": {
      "x": 8370,
      "y": -1430
    },
    "blank-23": {
      "x": 11190,
      "y": -740
    },
    "blank-24": {
      "x": 10710,
      "y": -1060
    },
    "blank-25": {
      "x": 11300,
      "y": -1200
    },
    "ending-3": {
      "x": 12120,
      "y": -740
    },
    "blank-23-2": {
      "x": 11660,
      "y": -740
    },
    "story-map": {
      "x": -1180,
      "y": -600
    }
  },
  "viewport": {
    "x": 680.1179103316697,
    "y": 740.0537212330723,
    "zoom": 0.44751253546398606
  },
  "view": "canvas"
}
