{
  "version": 1,
  "nodes": {
    "eea82644-827f-4394-b706-e7122a64baf5": {
      "x": 10,
      "y": -300
    },
    "edbd98ef-50c7-4fc1-b241-81d93d089247": {
      "x": 510,
      "y": -450
    }
  },
  "viewport": {
    "x": 81.65479508905997,
    "y": 607.1518214617661,
    "zoom": 0.9876180756904919
  },
  "view": "canvas"
}
